<?xml version="1.0" encoding="utf-8"?>
<table 
  xmlns:xsi="http://www.w3.org/2001/XMLSchema-instance" 
  xmlns="http://www.admin.ch/xmlns/siard/2.0/schema0/table0.xsd" 
  xsi:schemaLocation="http://www.admin.ch/xmlns/siard/2.0/schema0/table0.xsd table0.xsd">
  <row>
  
    <c1>true</c1> <!-- CBOOLEAN -->
    <c2>01</c2> <!-- CBIT -->
    <c3>31323334</c3> <!-- CBIT_32 -->
    <c4>1E1F2021222324252627282930313233</c4> <!-- CBIT_VARYING_160 -->
    <c5>1E</c5> <!-- CBINARY -->
    <c6>1E1F202122</c6> <!-- CBINARY_5 -->
    <c7>1E1F2021222324252627</c7> <!-- CBINARY_VARYING_32 -->
    <c8 file="record0.bin" length="16000" digestType="MD5" messageDigest="D1C411FC45542DCA86EEB1CC9B4B596C" /> <!-- CBINARY_LARGE_OBJECT -->
    <c9>A</c9> <!-- CCHARACTER -->
    <c10>ABCDE</c10> <!-- CCHARACTER_5 -->
    <c11>A varchar(32) text</c11> <!-- CCHARACTER_VARYING_32 -->
    <c12 file="record0.txt" length="84000" digestType="MD5" messageDigest="D1341187455adfCA86E5666C974B5950"/> <!-- CCHARACTER_LARGE_OBJECT -->
    <c13>Ä</c13> <!-- CNATIONAL_CHARACTER -->
    <c14>ABCDÖ</c14> <!-- CNATIONAL_CHARACTER_5 -->
    <c15>A national varchar(32) text</c15> <!-- CNATIONAL_CHARACTER_VARYING -->
    <c16 file="record0.txt" length="84000" digestType="MD5" messageDigest="243561FE455EBFCAA1256667774B5831" /> <!-- CNATIONAL_CHARACTER_LARGE_OBJECT -->
    <c17 file="record0.xml" length="10424" digestType="MD5" messageDigest="5234Fd874EFADFCA86E5CDDC97398991" /> <!-- CXML -->
    <c18>4321</c18> <!-- SMALLINT -->
    <c19>5</c19> <!-- CINTEGER -->
    <c20>98765432101234</c20> <!-- CBIGINT -->
    <c21>12345</c21> <!-- CDECIMAL -->
    <c22>123</c22> <!-- CDECIMAL_3 -->
    <c23>123.45</c23> <!-- CDECIMAL_5_2 -->
    <c24>54321</c24> <!-- NUMERIC -->
    <c25>123</c25> <!-- NUMERIC_3 -->
    <c26>123.45</c26> <!-- NUMERIC_5_2 -->
    <c27>3.14159</c27> <!-- CREAL -->
    <c28>3.14159</c28> <!-- CFLOAT -->
    <c29>3.141</c29> <!-- CFLOAT_13 -->
    <c30>987654321.0900</c30> <!-- CDOUBLE_PRECISION -->
    <c31>2013-10-18</c31> <!-- CDATE -->
    <c32>17:24:33</c32> <!-- CTIME -->
    <c33>17:24:33.12345</c33> <!-- CTIME_5 -->
    <c34>2011-12-05T16:24:33.123456</c34> <!-- CTIMESTAMP -->
    <c35>2011-12-05T16:24:33.1234567</c35> <!-- CTIMESTAMP_7 -->
  </row>
</table>